{
  "issue": "https://github.com/elsa-workflows/elsa-hub/issues/40",
  "schema": "https://github.com/elsa-workflows/elsa-hub/issues/37",
  "generated": "2026-10-15",
  "elsa_version": "3.9.0",
  "kit_release": {
    "tag": "workshop/solo-bundle-20261013",
    "commit": "9ff05b84558d50684d070172aaa64abb0bf4ac47",
    "asset": "elsa-fundamentals-workshop-kit.zip",
    "sha256": "3184ea17f87a76c9de4370cddd797635c21509cf28af09994f1bf8b44e81f9c2",
    "bytes": 132084,
    "storage_path": "kits/solo-bundle-20261013/elsa-fundamentals-workshop-kit.zip",
    "owner_course": "fundamentals-core"
  },
  "source_root": null,
  "link_convention": "lesson links are absolute /academy/<courseSlug>/<lessonSlug> (routes per #38)",
  "import_rules": [
    "strip the leading '# ' H1 from every source_md (it becomes title)",
    "apply module_rewrites (exact match, exactly one hit, fail otherwise)",
    "do not import labs/*-README.md mirrors, DH-INDEX.md, modules/INDEX.md, meta/, facilitator/"
  ],
  "courses": [
    {
      "slug": "fundamentals-core",
      "sort_order": 0,
      "title": "Elsa Workflows Fundamentals: Core",
      "summary": "Get productive with Elsa Workflows 3.9.0 on your own: host Elsa in ASP.NET Core, build and publish Flowcharts in Elsa Studio, expose HTTP workflows and debug instances. Modules 0 to 5 with hands-on Labs A to C.",
      "price_cents": null,
      "currency": null,
      "product_code": null,
      "todo": "price_cents, currency, product_code: Lead / Commercial (AC4)",
      "lessons": [
        {
          "slug": "overview",
          "title": "Course overview",
          "source_md": "academy/web-sources/fundamentals-core/overview.md",
          "estimated_minutes": 5,
          "is_preview": false,
          "built_from": [
            "self-paced/packaging/fundamentals-core/START-HERE.md",
            "self-paced/packaging/fundamentals-core/README.md"
          ],
          "sort_order": 0
        },
        {
          "slug": "kit-setup",
          "title": "Lab kit access & run",
          "source_md": "academy/web-sources/fundamentals-core/kit-setup.md",
          "estimated_minutes": 15,
          "is_preview": false,
          "built_from": [
            "self-paced/packaging/fundamentals-core/KIT-ACCESS.md"
          ],
          "sort_order": 1
        },
        {
          "slug": "start-here",
          "title": "Module 0: Start here",
          "source_md": "self-paced/packaging/fundamentals-core/modules/m00-start-here.md",
          "estimated_minutes": 30,
          "is_preview": true,
          "preview_reason": "Free taster: shows how the course works and gets the kit running, no paid lab content.",
          "sort_order": 2
        },
        {
          "slug": "mental-model",
          "title": "Module 1: Elsa 3 mental model",
          "source_md": "self-paced/packaging/fundamentals-core/modules/m01-mental-model.md",
          "estimated_minutes": 30,
          "is_preview": false,
          "sort_order": 3
        },
        {
          "slug": "hosting-persistence",
          "title": "Module 2: Hosting & persistence",
          "source_md": "self-paced/packaging/fundamentals-core/modules/m02-hosting-persistence.md",
          "estimated_minutes": 60,
          "is_preview": false,
          "sort_order": 4
        },
        {
          "slug": "studio-fundamentals",
          "title": "Module 3: Studio fundamentals",
          "source_md": "self-paced/packaging/fundamentals-core/modules/m03-studio-fundamentals.md",
          "estimated_minutes": 75,
          "is_preview": false,
          "sort_order": 5
        },
        {
          "slug": "http-workflows",
          "title": "Module 4: HTTP workflows",
          "source_md": "self-paced/packaging/fundamentals-core/modules/m04-http-workflows.md",
          "estimated_minutes": 75,
          "is_preview": false,
          "sort_order": 6
        },
        {
          "slug": "instances-debug",
          "title": "Module 5: Instances & debug (Core exit)",
          "source_md": "self-paced/packaging/fundamentals-core/modules/m05-instances-debug.md",
          "estimated_minutes": 45,
          "is_preview": false,
          "sort_order": 7
        }
      ],
      "assets": [
        {
          "label": "Lab kit (Elsa 3.9.0)",
          "storage_path": "fundamentals-core/elsa-fundamentals-workshop-kit.zip",
          "lesson_slug": null,
          "source": "self-paced/packaging/elsa-3.9.0/elsa-fundamentals-workshop-kit.zip",
          "extras": {
            "sha256": "3184ea17f87a76c9de4370cddd797635c21509cf28af09994f1bf8b44e81f9c2",
            "bytes": 132084,
            "description": "Workshop kit release workshop/solo-bundle-20261013 (commit 9ff05b84): host, Studio, labs A to H, S1 to S4, Approval Lite. Byte-identical to the GitHub release asset."
          }
        },
        {
          "label": "Course lessons, offline copy (Core)",
          "storage_path": "fundamentals-core/fundamentals-core-self-paced.zip",
          "lesson_slug": null,
          "source": "self-paced/packaging/elsa-3.9.0/fundamentals-core-self-paced.zip",
          "extras": {
            "sha256": "ea870a03c51931a856b88cb1c7cecb2c86210fefd0105d792f7190e6fccf60ee",
            "bytes": 10662,
            "description": "Current Core course zip (Markdown lessons for offline reading)."
          }
        }
      ],
      "extras": {
        "elsa_version": "3.9.0",
        "estimated_minutes_total": 335
      },
      "notes": [
        "Second preview suggestion: mental-model (Module 1), concept only, no kit needed."
      ],
      "extra_assets": []
    },
    {
      "slug": "fundamentals-complete",
      "sort_order": 1,
      "title": "Elsa Workflows Fundamentals: Complete",
      "summary": "The full Elsa Workflows 3.9.0 fundamentals path: everything in Core plus code-first workflows, control flow, bookmarks, testing and a capstone, with Labs A to H and the Securing an Elsa 3.9 host add-on (S1 to S4).",
      "price_cents": null,
      "currency": null,
      "product_code": null,
      "todo": "price_cents, currency, product_code: Lead / Commercial (AC4)",
      "lessons": [
        {
          "slug": "overview",
          "title": "Course overview",
          "source_md": "academy/web-sources/fundamentals-complete/overview.md",
          "estimated_minutes": 5,
          "is_preview": false,
          "built_from": [
            "self-paced/packaging/fundamentals-complete/START-HERE.md",
            "self-paced/packaging/fundamentals-complete/README.md"
          ],
          "sort_order": 0
        },
        {
          "slug": "kit-setup",
          "title": "Lab kit access & run (Complete)",
          "source_md": "academy/web-sources/fundamentals-complete/kit-setup.md",
          "estimated_minutes": 15,
          "is_preview": false,
          "built_from": [
            "self-paced/packaging/fundamentals-complete/KIT-ACCESS.md"
          ],
          "sort_order": 1
        },
        {
          "slug": "start-here",
          "title": "Module 0: Start here",
          "source_md": "self-paced/packaging/fundamentals-complete/modules/m00-start-here.md",
          "estimated_minutes": 30,
          "is_preview": true,
          "preview_reason": "Same free taster as Core: course method and kit setup, no paid lab content.",
          "sort_order": 2
        },
        {
          "slug": "mental-model",
          "title": "Module 1: Elsa 3 mental model",
          "source_md": "self-paced/packaging/fundamentals-complete/modules/m01-mental-model.md",
          "estimated_minutes": 30,
          "is_preview": false,
          "sort_order": 3
        },
        {
          "slug": "hosting-persistence",
          "title": "Module 2: Hosting & persistence",
          "source_md": "self-paced/packaging/fundamentals-complete/modules/m02-hosting-persistence.md",
          "estimated_minutes": 60,
          "is_preview": false,
          "sort_order": 4
        },
        {
          "slug": "studio-fundamentals",
          "title": "Module 3: Studio fundamentals",
          "source_md": "self-paced/packaging/fundamentals-complete/modules/m03-studio-fundamentals.md",
          "estimated_minutes": 75,
          "is_preview": false,
          "sort_order": 5
        },
        {
          "slug": "http-workflows",
          "title": "Module 4: HTTP workflows",
          "source_md": "self-paced/packaging/fundamentals-complete/modules/m04-http-workflows.md",
          "estimated_minutes": 75,
          "is_preview": false,
          "sort_order": 6
        },
        {
          "slug": "instances-debug",
          "title": "Module 5: Instances & debug (Core exit)",
          "source_md": "self-paced/packaging/fundamentals-complete/modules/m05-instances-debug.md",
          "estimated_minutes": 45,
          "is_preview": false,
          "sort_order": 7
        },
        {
          "slug": "code-first",
          "title": "Module 6: Code-first workflows",
          "source_md": "self-paced/packaging/fundamentals-complete/modules/m06-code-first.md",
          "estimated_minutes": 75,
          "is_preview": false,
          "sort_order": 8
        },
        {
          "slug": "control-flow",
          "title": "Module 7: Control flow",
          "source_md": "self-paced/packaging/fundamentals-complete/modules/m07-control-flow.md",
          "estimated_minutes": 60,
          "is_preview": false,
          "sort_order": 9
        },
        {
          "slug": "bookmarks",
          "title": "Module 8: Bookmarks & long-running",
          "source_md": "self-paced/packaging/fundamentals-complete/modules/m08-bookmarks.md",
          "estimated_minutes": 60,
          "is_preview": false,
          "sort_order": 10
        },
        {
          "slug": "testing-debug",
          "title": "Module 9: Testing & team debugging",